{
 "schema": "rtm-sealed-1.0",
 "contains": "rtm-assign-1.0",
 "program": "L2MN-DEMO",
 "round": 5,
 "enumerator_id": "E07",
 "note": "Protected file. Open it in the RTM interview tool with the passphrase your leader gave you.",
 "kdf": {
  "name": "PBKDF2",
  "hash": "SHA-256",
  "iterations": 600000,
  "salt": "QwH/asUtp+iGzPh+eUN09Q=="
 },
 "cipher": {
  "name": "AES-GCM",
  "iv": "zNykNiBdQdJhHMLP",
  "tag_bits": 128
 },
 "data": "orepYWfu17nwuqK38w74dWEjfxR64fac3mf/0IJJwnmZdh1UAQdCM6alY1GxULCD58EdF8pdyMBR8EUwzIm/XKDsV0hIGqFvIUYi4nb3lVFD68rMMelzlCBxCBufVsSUjXiNcCCY6qPg9Uj6NV2pkTvu+MSp8H4Q1gl9zkgjCEMDR/Q054k4UsHPnYrKpI4sAj3uweU1I0rYX/8K7pvy4y8d/RRYcnQAmPl+Ku7EdelBCsjyRn3OSJrgQc6Nhn7zAnN/cdZ6wXhkMWzfIpopE8pi8BmuqRUGPLSl2IN/QM02HHniKXHaqcukaGe2UIpXsVaNpyU1bBnoCL+u+O9thfnhyNCb3M6oGR/LuIXGUHTq0ojxPLcY0Yvg/Ag6Znoc8fbW/eVS/MJMPHDdalSdguNf5J0FJFGwRaSCYPAqdLrJwOhZmUjpI3p7XmBcb9dqyaMZ3FpJC5tkn6tSwVFxx8CWdGKoK6FRgQJ9q3l6Lok+Wl6xp06LQ0qy72UITvntkLsIVUs7SqZvHeel3syQKhRB0U8K1+EVcUYd/DJn6SMlumexLa2/GYhvgVEh4oMZVhuqWov+/qPLl03dOlEYnX/T5WRFGl6OW6L8eZBEppEnxTouHyirHMh0fNC96/7sYq2Q89jAgeDxJ+4TCkGD+IvlsJ70Q5YVvAdY6HTnORbtGXfFPhW5PDJcwjXGjyjGqos0dG0XC9KkWTigPd3QGTmw+Xp+ce4Aj/I/AfwukxJFIR3+SFdw7KAL22ah/wVOtmY1x91CAv+Kiy+uZu8pG3mauJ00K+GWXXU7nbeUZ3XK9dURNqW+10AmejJYwC6VNas5yuQqYRQFiTTJSyIM4lNFL3ong//ZWN9gs5YNJ+jq0QlYwN7lW8ktXebJZZQAb6i5Y/U3uTBnZF1x5W4+EyXVLnM6qvCkCek2kmghWbUv5Y9sgCJur7k36n5EUzCr3Rd/0osyASVmAl8QJ3JVBbnbPweR3tE/jg+Mgn0s8dRHAnPfLSeSOEsgOkePFSlRARZ07Kfp9qBPHEuRT96d7nJpws9JCEpqx9zSGzJBYcXDcmexYsxCmM08/V50KAE8idzwUdcCgzkDMbEx9i4Qh5achgnnUSn2IW3trb21m+AOatwBcPBBp0nXQghtBx/3Uy3Hq9lbf0dY0S6XpQeeE27YH51f3+a5PnX1ju2ul6kpGTDi0Gz1GemvxCynG0n24L7+mmt7m45Jlt0jCxnXftw9F6OzdY0Q9gfOVGGdwCseQOGGLnsmJWi3DESBpVN4YYazH09zJXDnTXmK+DZ/qZoT/zQog4AnXzIBlr+1f+jOWMc3O9aXdEc+DZGAJ3/S8QUyOeibLsSQdUWfZGNSdOUy3PKTXGf2K7Ip9A5078QnVNfudhCQSoyz0b0Y3Vd9E1cSBtPLjq3vxz/eD63ENLoJikwXJ4IPYfa/xLX5DNgX3b5mRPgNj3K4Hlnq/AL3fBSeH3xRXWDL0wZVl1sxuM56UgmfedEU3IGx3mePjjZNnXlJWgBEt+c9LeJYIixWxw0KO9gKRh4ZqBdcoZDt6/e3n5bvbaRY6smGHaX6BBTIwqF/clEOnL7o2GMctIIAy2K00WPM4yXdVX+6W4SswaSKoSWjkY+FNmvk/BNEMVqot91EvmPHvJ6jnC5OT7ruESszm91oBY8zTtrDTjAkXi6/kAb63/ANir3I0uYwCsmqFzuLCBBDiGu7iPeW6W3VHN0ADwyFsjH5bJV7RZ4q/nMCQZbpAvNR3nP8MLeVu+z4vMX8CspHwZoQnEwa9A9H7WZ+ZeuHeIMAwTyJ+3LOVZGog4F3sFZPtzSuMlQEtkZswohicD5lyGdg9GF2W3SaD4zd/A1MB6Wpzpzi0LD4XyKuYqiI9saLwH96IpiibdEs9XSPtXQRMoVrZdgoHNGJ5mgUkTK8Ed3WLxJZqn/G+UWFMJDxmoD70pkZojEPpHRcaKOl8nLdT7nMckIrbHf5/kP07OME2FbZOegMHsWWVU0fGkzRxYFRJLYQlCEnbgIs40Ar9CLql/xI+WkgrNE0RyEj00w/GEJVtVc4ed60HZhPaZjGgaSEFA5YvHOdrOlYEY2UFtbE4g3Jkf3zE3e8NJAwJcnF2YD5NtEgrMjvQz5S2WGQoieAbQJ7jvkgfR/sbYs68lfA36aXChKBu/mLB1AiWzAih647E7wiDC+nM0eAINezstkLUsZBRs2GCfrosdiGoh4SaZJIvUCRFYxbzCncWz++5r663aUSmCQz/82JqgvaLC2C6S+VwPbmo0+1G84qpNsmTaE5BO0U9RplwFOHjyUwnxSojdJNZQLE5D8rIuUPeCGnU0eptQVfR9erjsL/QYHHcSbl7e2ZqSzCrV1cYuMp3S6wCcHebb1dZs052NtQ1dnphKeJD37Yo2rWDd5mreM3+uF9Qp2jwM1TX6zYLRWW450ZnDaxBpzRrQlc0MaSwvb+Is3Y3ZxgrGkDS1ub8kBq1XQSuSL9vexAvWCIuKOZz1n2djZmsuHGINqZZlMCNda2ErHgrklIfxKrTR3aN5nRCEzYn7wkT0TsZLgeNIwrFAazWr0mHtcPSL5HMl7XsKjVdheQCunKv9YJr2S9g4svWBU2ceQPJHjhWxTwyAt5jl9Ly8SH8gC0cSR6/9HXcatJRHtQ62v2dhTk5EDFxJTXffiBA6416pFesWeogExg0If/cH5zlz/p7ikB6dQKniV2DIkgCfpFMOqyIan5aI57pbqqYZhyn9N6SaX/ckMQyBhJzKavmqPJmnFBuGM99Mj5uFPHrZRINxTxL5lUMuJXPY07wGyj8JZTcSuWqKTBB3Gy19TTTI1vBDt0MtQVHPV9r8xA4bxlXHMp7BbWyeLeVBkoUVUcCyT7yTQXAO8wq0gKzJtP07WvQh+jmQtWSm2KM3g1Im7OisY/7IQ8YWi0zQDMLyY31fFgil94QKrt0e5JM2djBKTJ/X+oVUvW7UgHYnbj+3jdNjRF988wPLgvANFNoghK2qgnOxBO23NgGKLKyOCD11ynVLkxV3nOuhKIRfeLhHyHpLpDwT5qDKoBcZcA83U1VpMR1hHEM7IPBFsZv/3C6A0r9zKGF4KDwXlceEKy7/P4QhtcLP9DBG6q7ujgBsjDXCM6X3wRsYAMR9nIoVTHbUuBOzMLlRM1BYQnEKAGMMVoJ2UwbiAkG9fMOsks/lpPoWNshxrPALr6DewT20Kk9bk/eckS4CoPklO1yoCEcYSkHAxWDoK6McGu/bpMP7fAqcTP/o3K0cqaNNmixdqooyw+emJNJWupgxvR3bsBpCtPUDaIMQoPknFVHKd/vqdJyOu9hDfdyhBX0b79MzPXzqZta/8PKcdZR0EgNE9BG6Lzfhj5+XYM5a+4tNbkS/3TYpDAZGqaIEQW/iplvCP8AKpk6WkaHdxnJS4AfMygNgAp8xRxw3Gklr65/LPkNSyp6KO+F6yVXv04lESRK0TpbgQSKoJBk7DrYgKELdUvz3rkpWS2NstdVSnJQIuD+ggirMfHjELGqL6fD8xKLm7Ixv5C8OSbSTkTQ93jL5glUH0YhZt6GAHttsRVmEVKahysollUqb9ErM2q3a2IqZEMqm6z33ZngCYyi66Bo5oK1qKrwfcS4Re006YrLKoaVU0eINmdMOkM6tyQMcKHsUqZB5C73IP+xK2wNSRzTV+fgSHyUfCPBbylI8sNqg/HBYVPevhYdF1fvht6nbSbJ/H0UPD5IZV3wg75/AMaPhs+ce5EhGLbKY8mdf2D2eRt6RZRBMSnx5ZsXFg7DfY+KS/EbZj0NJp4FLQTMObkWV24Lswlb+bQHX5hvUcTySClfZBcC3zmUFFZWqnt/Yowj+LnZ8JUdLDGD/aCFbLH3F9jRR//DxsV9/vrqwhXSt9vgArCufSt683ckr+G0ZlPY5DIcJkvKdJF6GZ8IXIQm8xQWjxRB8ntZC44jsffDr0gubLJNrAjb/xTx+w3cgb1L9yMhg390Bit/WltDqHj+MrqHq4rCzVmDBfvcDPGcAQ6jzfBQQiidgQbCLU2XWmjP2VeeGdSx6A1iO8Cr+9nB1gf73+iaSXMFunfg5j71BPeaZY3Eyr5GS6LRoy46svR7C3mMCrf7Cn20NIkEhKgBi7AAJ9K+Gk6xnD1FxFc6Y42uNvPuzUJU9LIaVFnpPZxBsPxBfiqbroExgj4Gnypc3JN/87hcz9h/LTP5s1WC1WxYw1NkRTnaPk6+TZp+UbgtT+feRQzEMsGffr/afas8klcf1sHMLei4eHqv1WEYzPywfguYCLPVs3h0Xeh87y3G8WRfNkcaYHAK6jCfq77rPHLiLR8m8O/qvLP4aT+wYIuWonA4OxeDbUSMkG4vpIPxYl8wixkkz0ZyUnVLdozEnz2ElUv4Uk0Df8UYfwdHfMLa9kRRumVTPpYRxg4alGhUKBp01a6ZIxTpq9ySe1OGFE/AZ5pc0phd+ACFpE031i2lfVSyRrPcrDnLuO7HkfGn5PKAgmLEcHC37YtBIyZYwtHk1xNVhCvxTAWFuGAZbBBrXtZeQm9xXw8hpJC8ts476RPKvS2ddJms5Ujwm8VSoXRh/qJy6ursB+tqsv8GVAZr7BVvtUkpWIqVj0LlNLCubmEw7hI32S8Eg7JejstPi41XniVofIqgK7Xry6SAM9byQ2MGESmA4Iz9Z7L9/XraXRnMiH3my1pNmg/YaeKf5M4vGmywavECqp71SHlSy36JKZ9TTsBjZcduWKmQq35CwyS/L+xu74mjTIc5+nXKoV4Zh8AkYYkFpRHVv4NVKzJ4BjOmBWvJ/W9vM9vhSlaKDPUtD6O0Yqrt7j/m2tq+X4emSUXxo0qrgP/Rp5Bf0P0CXmdgEbwmrlbueQTWodENJzDHkv7Xsfz4arzZYiAl/KHXKSXOkPqE2UvE2Vw2kLzhI3ifuolqNOcfB0NfEYEwli4WXUQJNkAnJM1sLB/cl2vBNEHz2QOiu4fEMWq8ULMqCwnkrXO9AzOL06hsnT+mN1jMW8MuagsOI8jzuOyrkk290qT6UGTi10isc6NnI65j9eEMU8nyrDdMtiA1PSVPVCARSH+SDVmD65kFFlKsqSw4AQCO656V+RWPaeTjnMSJYbKOL1cpZ8ivpvgfjKLxaEoxRQ5HDipMuzBKHXI2XUJpC/jtcqW62dIglhJdIolfHMQLzgRFBv07RLekK2ajpKuG2THao0zIEiVpOr+xqHR2d/TPwJPFsvB0cLjDQYXaNkS1i1CAaPMY4v7R+ixxudE6UDPWcIbVO3jj4S/kj4PBhC63ule6P60cmR/CWrCU4KFaLc9LzyPDExCckIRJwO5xFTHKIRQfwEujaCD5wBIxrtTrHAsqB/MMKsDyZUKWrIqBxtTK8u56LYW91D4a3g7TQMk6HW1M2Lmh7ajNgYGD6AmRr05MvEsTIxnFXIy+2Fy87RwVLNT7cFqn7kRobFga2KkVfDnTHehTF/v1wFsf50azgSmZaDiOUJgi0VYE+kCxcZtrP9tY99ioFJ5C4bpcaBfsn87qZHHz2JT98tgox1bJjGcHUtVt7EsVR83P5q4qKmpxdjuAXckYMLTnWij+xJt2mqcbd+7j1PCf8xjMM8jWDax8y9HnMkxX6LXNLpQ6EV98HrBX+oF9ZAapvefUEz/0b9WCSJ4bC1kjOF/bR8EibqbydXG/HkhAyLq+eF4DJGQyJVTVcADRVZpljBGHsW6u1rg2TtRDWKPhvqufBLASBIyxpHFXvRiXSEZO6o5L1p7n1pdgTVYxmBUO4VjwUZKSooHUsE09qrb8NQnAA1AIV8lQsnYcpkaXFOcCGpWxAYqG8Ok7MfEJxLE6ceq+URLUuyOwzlUJwx5/KJcK7KwX/Qdpg3p+1uFdUWD77nbMK71LRDCSLFQJwP58nH8Qg26+stTW0z7rVIpbXOxjlFFR0h0PW3MUuNqwL+oar664aqrr+IFs4qA3xq36rJJXntGMKyr2whgCw2N/ZHxngQ5TKk39M2l/Nix+8S/fBGNkWi4vj/rJPt5i65Z6yi2/ai2P/lhSu796ywthbAlWwkp2bDLI8XwEoqQtEKFjlikeSag5+gBFSX1Ee7PGI0Bwk+u1DPGCHes98Snb3OXo0WCA+c1yGkycIdIFQpRdbjGTpIGxrNZWNsv5ROYazAIl1kIKGLFJAEFxKXy1A2QStDV3iMudUHyXFJVBs1kZX3c/44KEGY/6xdDq7v95BZmOilMZDJuEazpy4QR9Gfa14HOa+pEdI4e+2Xz2U+p+qPLdvkDZOn4sv9W60/Asdmgg/tsqsrXl1LvBTcK5/5q5AKGeSnDc34q5SOXPxM+wBPhUjehEYSfm6KALeQ0Rq1dtqEZG8vQK1sMs3Q8z7uoeVYEyzT5G/8YmlX4lUnWOOJRuph7FWl+lRUXrb6vcXe1A14c7RvdYWijksToh6L/UaX4dUdopBOKTzWMuj+xDBloxdk35w77YekO9CTbeX/P5klWxW7iY2jSrMQud1zGPaxRnxZ84W+Gj62GTLeHtTxx7aGPaMu0zh6AfmJ7SEFIIJ/v9d1gVzv/WMu/mCj0cNFxaJC7o6HEE92K7Cd8EIbc120loRIXMK13RcICZgtHa3avPebzqjERKn/DN12HQL4UCsVgD6EpbJoKiiZBKj3F57Mj71QQp7LW8ZSS79aPazYkU/IGmqxR7RmOSuAL7ET/vFEiLJNw0Qjys+2LmyYKn/k+ac98fnMC1d393gkbzUbisNzUy+RJ5OcO++wl6O+MnZ1/Rr4CZ2CzUu08vL8FigOg916vah1WrNjcgR0jBPFFin0M191ZMjOf4wolcNN16Iz8JguIWQ0aMjc1ud1ousyuOKtd/sFNMtB5dOGOmP/1/90p4ukXxeo2Q9JRt9VMXLUSeE9/fk0hspbjxHRwSbnpN5eQdykIMrqckrzgcGx2gTLA6f37GYJnMLADJ26D9s3IUJ4hSpzCsZGlNSxfED1opRX+RQPi9+3ANgszkDC5vCi02DFc1EzBO3OUYSB4EAwMAmjXBtCxrc1d+oYaW5pfeTTTZVUpmu9MNfDKYgHJRtGFngftljaq3doNGV7fSXI53GRV5C3flCvT6J56muzVvk26ds2COd1m5Ntf9UY2957rNS3DnvUrpgnqFS2pWyeGGhtf8YKcXIWnpQitJUYkagvuAjd8NTHp6qW4MC9KhSHE/saDgEo7fFqxQqiQB0rnyueqfxs3txTjQEeA6nOPcg4iGuZ81xOsKrFu6/MgC0bh62egOYjbXltz6puarULrURkVPWMhS6p7KuLihcYJM21gXbkmi2hQcdAzfbPS90OHFD5iSdiShD+Y/aGGh6VyZrfwv5wN2hyM8QS5yvATaFno9lRr7frZYBd85vbvWLD708ZthAkduC5fYUndEPEHVr9OBtIB4+mkTnKwNwTDwMkDS6CcObjfVCetD2HD2qlfWZwG59kcBy1kqBuukLK+5YUerfFAQLFTJ6qykRHMWrCEIjD1mliUl0ikDHNVeiOg1GO8aiKw3HRQ2AmJBwyNgnJXK5hvs5eks8HTapvkRElKWfMdTNuRphZj6rL7TAlzoYC4MboxNU5m4mJC2C53QxH7jwqnJ0bmiWlsm6ZjsIa7BM7S7QAzH0Zxt8sYPDL3K0WEVnkv5DOwDSNLwM4poWYlo8cZpnkZv3ElOWr0exbdglHGLWNqFkucN1VV/o08olPkGdY2tqOIfdCEa+MkALDxC+LZxoEWeuVTidrFZN4Q+GYcOmOyjqLlnnhgCFFuoNLH1Lo34tTcQuYVCHFqnOU80Skm+vjic5huHn/mPYghr640reFG8C6at7hiYM58HKN3I4TIIX1Ld+KQvIMht84bo5rb4SsCmj+4ViycZ0DNNbkmd1c/3H7mCbcI6DAb/Jup+KAADbGOTMIUK+U/odkprxNSkyiZZ5jidP27YTim+fXDXc1hHrjuow0fYxiscZvhbk0R2MqPJg1nOvlaqhkLN4GKo+vPufcXs//GwHVzwhake9Bd91fndZQIbz9XTrK8qj1mJCDTCqwfJYPViweIg2H3XVhnxFMv5UB9A96SyOLBur7nRHWE4oBkJNvxJzvJOX4Enrt75p+INntRfj14CIGPYvb9C9+AXoUpW65AwUIbOM02x5CdFehKJwzM6ZiIlwm8gEvYYVXA1QXLJEzQ50QiPnGEYuFvIoUlskAlpkm7Sys5Zp6mh8vXJ9BxVUiPtCAo8tOKTru67XYLoUXchgXekI/cbb9Od/IygXeBbjQp0VR8Bln51W0lAk/fRqiSlbFk6zqF/9gqVasjYcBUslY09GjeDKv5J3/m5NOTi48LM6aHQ7h3CH8uUaDVyolqYjq/pXYSs3JdXWo6Utm567WdJNF8fESb3ARaqVn1M5elWjCpyUem2szI9AEXtFu4mYdxlp3o5waKGnEfwW0cuf1IICOgH3RQzSTcguO61mcV+WAG/MClaqxABY89QRxhcsPXEpJe49Xu47prr8sZtnbbt/7OQ3R6zUoKxLkwfSE5PaIxjy2iCtGMeSk1YqolBbHBsvOrKnvmfOhLLjdLCQusJyAhxA//fgfgozzwoCOYz+22bQa2E5m7njMK+W/bou5G5Ar/KCc8ZNtgPoDOmA2b8WDeOMXb1tAGh0eJS+xNLfhH/kXrzHnSA3eC6V/7kj9j9l9cZ68B/9TvQJezo8331pSt21jXxGTd9EdUzo4NTAYU97JjO/hdKnAa0IPmiA3Doj3GQm9oG7kOopyXEem3Ii55jOWnINYtmC7BFh+C/EfEVBginRXq46r8uQUY5qdcUPjzmTMAeqvPj8d+pdNa7Vz5Ycdk7ZqQknRN1CkNc2w5z0iUGPHSX6TqsQFUPM7H/ve+hbkCxt8xq6cs3GcpNkUi9mej5X3r6dqw9Y9X1YE+dBEEwoeTGt+YzDYcgEgMKQMtLOaaO5BxItIZN0t6jh+GFJ65XUOnjH6OkHm/mvPvmxnNmjbGTY4XyejDPmq8cKoKkcjA7RsfWW7XOWFVGu9btaNMLA9pxjDmq0ESYcfwhTN0o8f+E6EuDwCtVR7IQNzdKrnqGY43IDr9SFJvlSWs61cUmrWHSEBRLU0ZaGrK24dPuItrjXlhGhIOnMJKnn/3FmP/0NhvC5QKQpyMOM4BrYlAsR3An3MY6oFYWLuCC8KDhkWjj/AS6ub4XvwnMQMjxcBgJmr579A7H/lwLBl8opzVKzNm/VdallnPCCav0sjEfTZCyrp57C/QL12YbwnIiZrAn6J/5Ic7tM4RuTqO80HMZmpA7W7ZrsUj6drSrH1X/Xoe2PPjN8YYD1PEnJRroSK21RA0QO48m6R8/7u/XckKMaCFez1YCVelq+6OaWduJH8OBA+FuUQlk36ANP1n3DmIIZcqC/w41PXKkgRX4ZCZ6kTbC9cQyKfCHHVFquZJm0PbjAPB+IJGB9pUBzoekFItDvwC7vaTTfIWvje8jGtvuEucfepOG+RNFzvcQoz/Yr/rRIyEZAthjsBqSbJjunIz7vZCpWAt/jCU54p6K+DJO7CHEpzrjPZE7oIQJzuCqHEfICvRP